{
  "document_type": "gallery_index",
  "input_dir": "examples/outputs",
  "provenance": {
    "command": "gallery-index",
    "input_dir": "examples/outputs"
  },
  "schema_version": "0.13",
  "stages": [
    {
      "artifact_count": 19,
      "artifacts": [
        {
          "bytes": 718,
          "document_type": null,
          "format": "md",
          "name": "checklist.md",
          "path": "examples/outputs/checklist.md",
          "schema_version": null,
          "stage": "fixtures",
          "suggested_next_command": "python -m leveraged_etp_risk_lab pretrade-plan --product examples/fixtures/leveraged_nasdaq_3x.json --path examples/fixtures/nasdaq_chop_path.csv --thesis-file examples/fixtures/thesis_note.md --max-loss-budget 750 --format markdown"
        },
        {
          "bytes": 6496,
          "document_type": "glossary",
          "format": "json",
          "name": "glossary.json",
          "path": "examples/outputs/glossary.json",
          "schema_version": "0.14",
          "stage": "fixtures",
          "suggested_next_command": "python -m leveraged_etp_risk_lab pretrade-plan --product examples/fixtures/leveraged_nasdaq_3x.json --path examples/fixtures/nasdaq_chop_path.csv --thesis-file examples/fixtures/thesis_note.md --max-loss-budget 750 --format markdown"
        },
        {
          "bytes": 5341,
          "document_type": "glossary",
          "format": "md",
          "name": "glossary.md",
          "path": "examples/outputs/glossary.md",
          "schema_version": "0.14",
          "stage": "fixtures",
          "suggested_next_command": "python -m leveraged_etp_risk_lab pretrade-plan --product examples/fixtures/leveraged_nasdaq_3x.json --path examples/fixtures/nasdaq_chop_path.csv --thesis-file examples/fixtures/thesis_note.md --max-loss-budget 750 --format markdown"
        },
        {
          "bytes": 2782,
          "document_type": "simulation_output",
          "format": "json",
          "name": "leveraged_nasdaq_3x.json",
          "path": "examples/outputs/leveraged_nasdaq_3x.json",
          "schema_version": "0.2",
          "stage": "fixtures",
          "suggested_next_command": "python -m leveraged_etp_risk_lab pretrade-plan --product examples/fixtures/leveraged_nasdaq_3x.json --path examples/fixtures/nasdaq_chop_path.csv --thesis-file examples/fixtures/thesis_note.md --max-loss-budget 750 --format markdown"
        },
        {
          "bytes": 1426,
          "document_type": "simulation_output",
          "format": "md",
          "name": "leveraged_nasdaq_3x.md",
          "path": "examples/outputs/leveraged_nasdaq_3x.md",
          "schema_version": "0.2",
          "stage": "fixtures",
          "suggested_next_command": "python -m leveraged_etp_risk_lab pretrade-plan --product examples/fixtures/leveraged_nasdaq_3x.json --path examples/fixtures/nasdaq_chop_path.csv --thesis-file examples/fixtures/thesis_note.md --max-loss-budget 750 --format markdown"
        },
        {
          "bytes": 3097,
          "document_type": "exposure_report",
          "format": "json",
          "name": "portfolio_exposure.json",
          "path": "examples/outputs/portfolio_exposure.json",
          "schema_version": "0.2",
          "stage": "fixtures",
          "suggested_next_command": "python -m leveraged_etp_risk_lab pretrade-plan --product examples/fixtures/leveraged_nasdaq_3x.json --path examples/fixtures/nasdaq_chop_path.csv --thesis-file examples/fixtures/thesis_note.md --max-loss-budget 750 --format markdown"
        },
        {
          "bytes": 1430,
          "document_type": "exposure_report",
          "format": "md",
          "name": "portfolio_exposure.md",
          "path": "examples/outputs/portfolio_exposure.md",
          "schema_version": "0.2",
          "stage": "fixtures",
          "suggested_next_command": "python -m leveraged_etp_risk_lab pretrade-plan --product examples/fixtures/leveraged_nasdaq_3x.json --path examples/fixtures/nasdaq_chop_path.csv --thesis-file examples/fixtures/thesis_note.md --max-loss-budget 750 --format markdown"
        },
        {
          "bytes": 317,
          "document_type": null,
          "format": "csv",
          "name": "regime_chop.csv",
          "path": "examples/outputs/regime_chop.csv",
          "schema_version": null,
          "stage": "fixtures",
          "suggested_next_command": "python -m leveraged_etp_risk_lab regime-export --regime volatility_cluster --output volatility_cluster_path.csv"
        },
        {
          "bytes": 7916,
          "document_type": "regime_gallery",
          "format": "json",
          "name": "regime_gallery.json",
          "path": "examples/outputs/regime_gallery.json",
          "schema_version": "0.7",
          "stage": "fixtures",
          "suggested_next_command": "python -m leveraged_etp_risk_lab regime-export --regime volatility_cluster --output volatility_cluster_path.csv"
        },
        {
          "bytes": 4525,
          "document_type": "regime_gallery",
          "format": "md",
          "name": "regime_gallery.md",
          "path": "examples/outputs/regime_gallery.md",
          "schema_version": "0.7",
          "stage": "fixtures",
          "suggested_next_command": "python -m leveraged_etp_risk_lab regime-export --regime volatility_cluster --output volatility_cluster_path.csv"
        },
        {
          "bytes": 258,
          "document_type": null,
          "format": "csv",
          "name": "regime_gap_down.csv",
          "path": "examples/outputs/regime_gap_down.csv",
          "schema_version": null,
          "stage": "fixtures",
          "suggested_next_command": "python -m leveraged_etp_risk_lab regime-export --regime volatility_cluster --output volatility_cluster_path.csv"
        },
        {
          "bytes": 302,
          "document_type": null,
          "format": "csv",
          "name": "regime_rebound.csv",
          "path": "examples/outputs/regime_rebound.csv",
          "schema_version": null,
          "stage": "fixtures",
          "suggested_next_command": "python -m leveraged_etp_risk_lab regime-export --regime volatility_cluster --output volatility_cluster_path.csv"
        },
        {
          "bytes": 364,
          "document_type": null,
          "format": "csv",
          "name": "regime_trend_down.csv",
          "path": "examples/outputs/regime_trend_down.csv",
          "schema_version": null,
          "stage": "fixtures",
          "suggested_next_command": "python -m leveraged_etp_risk_lab regime-export --regime volatility_cluster --output volatility_cluster_path.csv"
        },
        {
          "bytes": 368,
          "document_type": null,
          "format": "csv",
          "name": "regime_trend_up.csv",
          "path": "examples/outputs/regime_trend_up.csv",
          "schema_version": null,
          "stage": "fixtures",
          "suggested_next_command": "python -m leveraged_etp_risk_lab regime-export --regime volatility_cluster --output volatility_cluster_path.csv"
        },
        {
          "bytes": 366,
          "document_type": null,
          "format": "csv",
          "name": "regime_volatility_cluster.csv",
          "path": "examples/outputs/regime_volatility_cluster.csv",
          "schema_version": null,
          "stage": "fixtures",
          "suggested_next_command": "python -m leveraged_etp_risk_lab regime-export --regime volatility_cluster --output volatility_cluster_path.csv"
        },
        {
          "bytes": 2539,
          "document_type": "simulation_output",
          "format": "json",
          "name": "single_stock_2x.json",
          "path": "examples/outputs/single_stock_2x.json",
          "schema_version": "0.2",
          "stage": "fixtures",
          "suggested_next_command": "python -m leveraged_etp_risk_lab pretrade-plan --product examples/fixtures/leveraged_nasdaq_3x.json --path examples/fixtures/nasdaq_chop_path.csv --thesis-file examples/fixtures/thesis_note.md --max-loss-budget 750 --format markdown"
        },
        {
          "bytes": 1372,
          "document_type": "simulation_output",
          "format": "md",
          "name": "single_stock_2x.md",
          "path": "examples/outputs/single_stock_2x.md",
          "schema_version": "0.2",
          "stage": "fixtures",
          "suggested_next_command": "python -m leveraged_etp_risk_lab pretrade-plan --product examples/fixtures/leveraged_nasdaq_3x.json --path examples/fixtures/nasdaq_chop_path.csv --thesis-file examples/fixtures/thesis_note.md --max-loss-budget 750 --format markdown"
        },
        {
          "bytes": 3751,
          "document_type": "template_gallery",
          "format": "json",
          "name": "template_gallery.json",
          "path": "examples/outputs/template_gallery.json",
          "schema_version": "0.4",
          "stage": "fixtures",
          "suggested_next_command": "python -m leveraged_etp_risk_lab template-export --template generic-3x-long-index --output generic_index_3x.json"
        },
        {
          "bytes": 2751,
          "document_type": "template_gallery",
          "format": "md",
          "name": "template_gallery.md",
          "path": "examples/outputs/template_gallery.md",
          "schema_version": "0.4",
          "stage": "fixtures",
          "suggested_next_command": "python -m leveraged_etp_risk_lab template-export --template generic-3x-long-index --output generic_index_3x.json"
        }
      ],
      "stage": "fixtures",
      "suggested_next_command": "python -m leveraged_etp_risk_lab pretrade-plan --product examples/fixtures/leveraged_nasdaq_3x.json --path examples/fixtures/nasdaq_chop_path.csv --thesis-file examples/fixtures/thesis_note.md --max-loss-budget 750 --format markdown"
    },
    {
      "artifact_count": 5,
      "artifacts": [
        {
          "bytes": 961,
          "document_type": "run_comparison",
          "format": "json",
          "name": "compare_runs.json",